<?xml version="1.0" encoding="UTF-8"?>
<PointsOfInterestsRes xmlns:xsi="http://www.w3.org/2001/XMLSchema-instance"
 xsi:noNamespaceSchemaLocation="file:/Users/Petr/jPower8/new-developer/response.xsd">
    <places>
        <item>
            <id>0</id>
            <name>name0</name>
            <address>
                <street>street0</street>
                <houseNo>houseNo0</houseNo>
                <town>town0</town>
                <postal>postal0</postal>
                <country>country0</country>
            </address>
            <type>atm</type>
            <url>url0</url>
            <hours>
                <hour>
                    <day>4</day>
                    <from>from0</from>
                    <to>to0</to>
                </hour>
                <hour>
                    <day>5</day>
                    <from>from1</from>
                    <to>to1</to>
                </hour>
                <hour>
                    <day>6</day>
                    <from>from2</from>
                    <to>to2</to>
                </hour>
                <hour>
                    <day>7</day>
                    <from>from3</from>
                    <to>to3</to>
                </hour>
            </hours>
        </item>
        <item>
            <id>0</id>
            <name>name1</name>
            <address>
                <street>street1</street>
                <houseNo>houseNo1</houseNo>
                <town>town1</town>
                <postal>postal1</postal>
                <country>country1</country>
            </address>
            <type>atm</type>
            <url>url1</url>
            <hours>
                <hour>
                    <day>1</day>
                    <from>from4</from>
                    <to>to4</to>
                </hour>
                <hour>
                    <day>2</day>
                    <from>from5</from>
                    <to>to5</to>
                </hour>
                <hour>
                    <day>3</day>
                    <from>from6</from>
                    <to>to6</to>
                </hour>
                <hour>
                    <day>4</day>
                    <from>from7</from>
                    <to>to7</to>
                </hour>
            </hours>
        </item>
        <item>
            <id>0</id>
            <name>name2</name>
            <address>
                <street>street2</street>
                <houseNo>houseNo2</houseNo>
                <town>town2</town>
                <postal>postal2</postal>
                <country>country2</country>
            </address>
            <type>atm</type>
            <url>url2</url>
            <hours>
                <hour>
                    <day>2</day>
                    <from>from8</from>
                    <to>to8</to>
                </hour>
                <hour>
                    <day>3</day>
                    <from>from9</from>
                    <to>to9</to>
                </hour>
                <hour>
                    <day>4</day>
                    <from>from1</from>
                    <to>to10</to>
                </hour>
                <hour>
                    <day>5</day>
                    <from>from1</from>
                    <to>to11</to>
                </hour>
            </hours>
        </item>
        <item>
            <id>0</id>
            <name>name3</name>
            <address>
                <street>street3</street>
                <houseNo>houseNo3</houseNo>
                <town>town3</town>
                <postal>postal3</postal>
                <country>country3</country>
            </address>
            <type>atm</type>
            <url>url3</url>
            <hours>
                <hour>
                    <day>1</day>
                    <from>from1</from>
                    <to>to12</to>
                </hour>
                <hour>
                    <day>2</day>
                    <from>from1</from>
                    <to>to13</to>
                </hour>
                <hour>
                    <day>3</day>
                    <from>from1</from>
                    <to>to14</to>
                </hour>
                <hour>
                    <day>7</day>
                    <from>from2</from>
                    <to>to15</to>
                </hour>
            </hours>
        </item>
    </places>
    <filter>
        <type>type4</type>
        <pageLimit>0</pageLimit>
        <brand>1</brand>
    </filter>
</PointsOfInterestsRes>
